[
  {
    "schemaVersion": 1,
    "id": "FIATranslationGuide@eb74445",
    "collection": "FIATranslationGuide",
    "revision": "eb744452eb8d7c852caadde9d3181cddfe571119",
    "licenseInfo": "{\"title\":\"Familiarization, Internalization, Articulation (Fia)\",\"copyright\":{\"dates\":\"2025\",\"holder\":{\"name\":\"Word Collective\",\"url\":\"https://wordcollective.com\"}},\"licenses\":[{\"eng\":{\"name\":\"CC BY-SA 4.0 license\",\"url\":\"https://creativecommons.org/licenses/by-sa/4.0/legalcode.en\"}}],\"showAdaptationNoticeForEnglish\":false,\"showAdaptationNoticeForNonEnglish\":true}",
    "adaptationNotice": "<p><b>Familiarization, Internalization, Articulation (FIA) Translation Guide</b> © 2025 Word Collective Released under CC BY-SA 4.0 license. <cite>Familiarization, Internalization, Articulation (FIA) Translation Guide</cite> has been adapted in the following languages Tok Pisin, عربي, Français, हिंदी, Bahasa Indonesia, Português, Русский, Español, Kiswahili, 简体中文 from <cite>Familiarization, Internalization, Articulation (FIA)</cite> © 2025 Word Collective Released under CC BY-SA 4.0 license by Mission Mutual</p>",
    "holders": [
      "Word Collective",
      "Mission Mutual"
    ],
    "url": "https://github.com/BibleAquifer/FIATranslationGuide",
    "metadataSha256": "3679840cfc1a962ae3d00759842b17c6abdd3ce06d6a202c0645af1843bbeca4"
  },
  {
    "schemaVersion": 1,
    "id": "FIAImages@136ff7c",
    "collection": "FIAImages",
    "revision": "136ff7c6b2381b84d241e27524005dcad71424ba",
    "licenseInfo": "{\"title\":\"Familiarization, Internalization, Articulation (Fia) Images\",\"copyright\":{\"dates\":\"2025\",\"holder\":{\"name\":\"Word Collective\",\"url\":\"https://wordcollective.com\"}},\"licenses\":[{\"eng\":{\"name\":\"CC BY-SA 4.0 license\",\"url\":\"https://creativecommons.org/licenses/by-sa/4.0/legalcode.en\"}}],\"showAdaptationNoticeForEnglish\":false,\"showAdaptationNoticeForNonEnglish\":false}",
    "adaptationNotice": "<p><b>Familiarization, Internalization, Articulation (FIA) Images</b> © 2025 Word Collective Released under CC BY-SA 4.0 license. <cite>Familiarization, Internalization, Articulation (FIA) Images</cite> has been adapted in the following languages Tok Pisin, عربي, Français, हिंदी, Bahasa Indonesia, Português, Русский, Español, Kiswahili, 简体中文 from <cite>Familiarization, Internalization, Articulation (FIA)</cite> © 2025 Word Collective. Released under CC BY-SA 4.0 license by Mission Mutual</p>",
    "holders": [
      "Word Collective",
      "Mission Mutual"
    ],
    "url": "https://github.com/BibleAquifer/FIAImages",
    "metadataSha256": "5cc1661483868d10069db864c3c3879ff4561fb9ad59523a1fee2bca3de93219"
  },
  {
    "schemaVersion": 1,
    "id": "FIAMaps@4bc9bb9",
    "collection": "FIAMaps",
    "revision": "4bc9bb9f1d9082e5d71a047a35bf8e608f473602",
    "licenseInfo": "{\"title\":\"Familiarization, Internalization, Articulation (Fia) Maps\",\"copyright\":{\"dates\":\"2025\",\"holder\":{\"name\":\"Biblica\",\"url\":\"https://www.biblica.com\"}},\"licenses\":[{\"eng\":{\"name\":\"CC BY-SA 4.0 license\",\"url\":\"https://creativecommons.org/licenses/by-sa/4.0/legalcode.en\"}}],\"showAdaptationNoticeForEnglish\":false,\"showAdaptationNoticeForNonEnglish\":false}",
    "adaptationNotice": "<p><b>Familiarization, Internalization, Articulation (FIA) Maps</b> © 2025 Word Collective Released under CC BY-SA 4.0 license. <cite>Familiarization, Internalization, Articulation (FIA) Maps</cite> has been adapted in the following languages Tok Pisin, عربي, Français, हिंदी, Bahasa Indonesia, Português, Русский, Español, Kiswahili, 简体中文 from <cite>Familiarization, Internalization, Articulation (FIA)</cite> © 2025 Word Collective. Released under CC BY-SA 4.0 license by Mission Mutual</p>",
    "holders": [
      "Biblica",
      "Word Collective",
      "Mission Mutual"
    ],
    "url": "https://github.com/BibleAquifer/FIAMaps",
    "metadataSha256": "622379064594fbf621838faa540edda3f157c6098941b9e820d9d1cc7ef15e0a",
    "discrepancies": [
      "holder differs between license_info (\"Biblica\") and adaptation_notice (\"Word Collective\")"
    ]
  },
  {
    "schemaVersion": 1,
    "id": "FIAKeyTerms@a392606",
    "collection": "FIAKeyTerms",
    "revision": "a39260670bba9d87d902e0fa0ae447341343481f",
    "licenseInfo": "{\"title\":\"Familiarization, Internalization, Articulation (Fia) Terms\",\"copyright\":{\"dates\":\"2025\",\"holder\":{\"name\":\"Word Collective\",\"url\":\"https://wordcollective.com\"}},\"licenses\":[{\"eng\":{\"name\":\"CC BY-SA 4.0 license\",\"url\":\"https://creativecommons.org/licenses/by-sa/4.0/legalcode.en\"}}],\"showAdaptationNoticeForEnglish\":false,\"showAdaptationNoticeForNonEnglish\":true}",
    "adaptationNotice": "<p><b>Familiarization, Internalization, Articulation (FIA) Key Terms</b> © 2025 Word Collective Released under CC BY-SA 4.0 license. <cite>Familiarization, Internalization, Articulation (FIA) Key Terms</cite> has been adapted in the following languages Tok Pisin, عربي, Français, हिंदी, Bahasa Indonesia, Português, Русский, Español, Kiswahili, 简体中文 from <cite>Familiarization, Internalization, Articulation (FIA)</cite> © 2025 Word Collective. Released under CC BY-SA 4.0 license by Mission Mutual</p>",
    "holders": [
      "Word Collective",
      "Mission Mutual"
    ],
    "url": "https://github.com/BibleAquifer/FIAKeyTerms",
    "metadataSha256": "a874085a1a630aaa48cf3dddc10181f2877ad277a670b217c6f47de5eff78d16",
    "discrepancies": [
      "license_info.title (\"Familiarization, Internalization, Articulation (Fia) Terms\") differs from resource title (\"Familiarization, Internalization, Articulation (FIA) Key Terms\")"
    ]
  },
  {
    "schemaVersion": 1,
    "id": "VideoBibleDictionary@1c02713",
    "collection": "VideoBibleDictionary",
    "revision": "1c02713d022bd96a29c78f5b75455315d6d35a6e",
    "licenseInfo": "{\"title\":\"Video Bible Dictionary\",\"copyright\":{\"dates\":\"2025\",\"holder\":{\"name\":\"Word Collective\",\"url\":\"https://wordcollective.com\"}},\"licenses\":[{\"eng\":{\"name\":\"CC BY-SA 4.0 license\",\"url\":\"https://creativecommons.org/licenses/by-sa/4.0/legalcode.en\"}}],\"showAdaptationNoticeForEnglish\":false,\"showAdaptationNoticeForNonEnglish\":false}",
    "adaptationNotice": "<p><b>Video Bible Dictionary</b> © 2025 Word Collective. Released under CC BY-SA 4.0 license. <cite>Video Bible Dictionary</cite> has been adapted in the following languages: Tok Pisin, عربي, Français, हिंदी, Bahasa Indonesia, Português, Русский, Español, Kiswahili, 简体中文 from <cite>Video Bible Dictionary</cite> © 2025 Word Collective. Released under CC BY-SA 4.0 license by Mission Mutual</p>",
    "holders": [
      "Word Collective",
      "Mission Mutual"
    ],
    "url": "https://github.com/BibleAquifer/VideoBibleDictionary",
    "metadataSha256": "cea47724dbe681d99154df819d694d1d55cb32a58e2f00a3eac1cc87ff300071",
    "discrepancies": [
      "license_info.title (\"Video Bible Dictionary\") differs from resource title (\"Familiarization, Internalization, Articulation (FIA) Videos\")"
    ]
  },
  {
    "schemaVersion": 1,
    "id": "BereanStandardBible@87858d1",
    "collection": "BereanStandardBible",
    "revision": "87858d1e28ab728249d9fb50667170c194c6b013",
    "licenseInfo": "{\"title\":\"Berean Standard Bible\",\"copyright\":{\"dates\":null,\"holder\":{\"name\":\"Berean Standard Bible\",\"url\":\"https://berean.bible\"}},\"licenses\":[{\"eng\":{\"name\":\"Public Domain CC0\",\"url\":\"https://creativecommons.org/public-domain/cc0/\"}}],\"showAdaptationNoticeForEnglish\":false,\"showAdaptationNoticeForNonEnglish\":false}",
    "holders": [
      "Berean Standard Bible"
    ],
    "url": "https://github.com/BibleAquifer/BereanStandardBible",
    "metadataSha256": "adc7fe91fab370bfd5bb7b8ef3eadc1f0c328becfc8f9db056aafff2f1a14ee1"
  },
  {
    "schemaVersion": 1,
    "id": "unfoldingWordLiteral@e49bdf4",
    "collection": "unfoldingWordLiteral",
    "revision": "e49bdf4a0ddcdfe17428ca23e6dada29f54c0ea6",
    "licenseInfo": "{\"licenses\":[{\"eng\":{\"name\":\"CC BY-SA 4.0\",\"url\":\"https://creativecommons.org/licenses/by-sa/4.0/legalcode.en\"}}],\"title\":\"unfoldingWord Literal Text\",\"copyright\":{\"holder\":{\"name\":\"unfoldingWord\",\"url\":\"https://unfoldingword.org\"},\"dates\":\"2026\"},\"showAdaptationNoticeForEnglish\":false,\"showAdaptationNoticeForNonEnglish\":false}",
    "holders": [
      "unfoldingWord"
    ],
    "url": "https://github.com/BibleAquifer/unfoldingWordLiteral",
    "metadataSha256": "15868710f1d1deb14b1ff282b2c5be2224298ba0ae17f2d08cb6734a3869d143"
  },
  {
    "schemaVersion": 1,
    "id": "unfoldingWordSimplified@41a5b93",
    "collection": "unfoldingWordSimplified",
    "revision": "41a5b938d4f170278f8e43e7dce4df9e87e7a4bd",
    "licenseInfo": "{\"licenses\":[{\"eng\":{\"name\":\"CC BY-SA 4.0\",\"url\":\"https://creativecommons.org/licenses/by-sa/4.0/legalcode.en\"}}],\"title\":\"unfoldingWord Simplified Text\",\"copyright\":{\"holder\":{\"name\":\"unfoldingWord\",\"url\":\"https://unfoldingword.org\"},\"dates\":\"2026\"},\"showAdaptationNoticeForEnglish\":false,\"showAdaptationNoticeForNonEnglish\":false}",
    "holders": [
      "unfoldingWord"
    ],
    "url": "https://github.com/BibleAquifer/unfoldingWordSimplified",
    "metadataSha256": "9eae8853a32d97dbbc4f9a6a3f03f81cf422be60bac89698c732d20ac64c4ea0"
  },
  {
    "schemaVersion": 1,
    "id": "WorldEnglishBible@bcb8b3e",
    "collection": "WorldEnglishBible",
    "revision": "bcb8b3edfb302863c241e3d1d2062cf51042d694",
    "licenseInfo": "{\"title\":\"World English Bible\",\"copyright\":{\"dates\":null,\"holder\":{\"name\":\"Public Domain\",\"url\":null}},\"licenses\":[{\"eng\":{\"name\":\"Public Domain CC0\",\"url\":\"https://creativecommons.org/public-domain/cc0/\"}}],\"showAdaptationNoticeForEnglish\":false,\"showAdaptationNoticeForNonEnglish\":false}",
    "holders": [
      "Public Domain"
    ],